[
  {
    "path": "experiments/tfpt-discovery/hecke_index_theorem_probe.py",
    "round": "TFPT.HECKE.INDEX.01",
    "role": "probe",
    "ledger_ids": [],
    "status_raw": "[C] experiment-only classical torus index theorem; physical modular bridge killed; no ledger or RH claim",
    "kind": "ATTACK",
    "family": "LATTICE_E8_HECKE",
    "family_secondary": [
      "ADELIC_GROUPOID_CONNES",
      "OPERATOR_SPECTRAL",
      "PRIME_EVENT_LOG_DECODING"
    ],
    "question": "Do marked Hecke correspondences derive index-graded modular time on a physical TFPT Hilbert space?",
    "mechanism": "Exact torus covering indices, Gaussian splitting, heat-state modular diagnostics, sublattice zeta coefficients, and compact-cutoff trace comparison.",
    "result_verdict": "L1_PROVED_CLASSICAL + L2_KILLED(K2) + EQUALITY_HUNT=CONNES_DICHOTOMY",
    "outcome": "KILLED",
    "solved": "The torus covering index is classical; no physical TFPT state derives index modular flow [C].",
    "failed_because": "The 4D physical-space action is absent; torus modular flow is trivial or mode-dependent, and cutoff growth is polynomial.",
    "failure_class": "NO_BRIDGE",
    "rh_relevance": "IDENTITY_SIDE",
    "artifacts": {
      "probe": "experiments/tfpt-discovery/hecke_index_theorem_probe.py",
      "result_json": "experiments/tfpt-discovery/hecke_index_theorem_result.json",
      "tex": null,
      "lean": [],
      "figures": []
    },
    "reusable": "Exact covering-index harness, Gaussian prime-splitting table, rank-eight HNF coefficients, and heat-modular counterexample.",
    "depends_on": [
      "experiments/tfpt-discovery/census_qsm_normflow_probe.py",
      "experiments/tfpt-discovery/positive_cone_blindness_probe.py",
      "verification/v1013_thermodynamic_dynamics.py",
      "verification/v446_seam_clock_invariance.py"
    ],
    "readme_lines": "",
    "confidence": "high"
  }
]
