[
  {
    "path": "experiments/tfpt-discovery/positive_cone_blindness_probe.py",
    "round": "PRIME.POSITIVE.CONE.BLINDNESS.01",
    "role": "probe",
    "ledger_ids": [],
    "status_raw": "[W] experiment-only working tree; no ledger claim",
    "kind": "ATTACK",
    "family": "SCREW_SUBORDINATION_LSTAR",
    "family_secondary": [
      "TOEPLITZ_MOMENT_POSITIVITY",
      "OPERATOR_SPECTRAL"
    ],
    "question": "Can support-only positive-measure or square sources certify positivity of a signed Weil window without comparing negative and positive masses?",
    "mechanism": "Exact Fraction scaling lemma, moment matrices, block separation, Farkas witness, source classification, and operator-template kill search.",
    "result_verdict": "LEMMA_PROVED",
    "outcome": "PROVED",
    "solved": "Nu-scaling-invariant positive-cone certificates are structurally insufficient; a metric comparison or operator bridge is required [C].",
    "failed_because": "",
    "failure_class": "NOT_APPLICABLE",
    "rh_relevance": "FINITE_FRAGMENT",
    "artifacts": {
      "probe": "experiments/tfpt-discovery/positive_cone_blindness_probe.py",
      "result_json": "experiments/tfpt-discovery/positive_cone_blindness_result.json",
      "tex": null,
      "lean": [],
      "figures": []
    },
    "reusable": "Exact scaling no-go, rational moment threshold, and positivity-source classification.",
    "depends_on": [
      "verification/v963_lstar_reduction_dictionary.py",
      "verification/v540_amplitude_linear_carrier.py",
      "verification/v537_halfintegral_bridge.py",
      "verification/v539_weil_structure_family.py"
    ],
    "readme_lines": "",
    "confidence": "high"
  }
]
