[
  {
    "path": "experiments/tfpt-discovery/census_qsm_normflow_probe.py",
    "round": "CENSUS.QSM.NORMFLOW.01",
    "role": "probe",
    "ledger_ids": [],
    "status_raw": "[C] experiment-only classical arithmetic QSM construction; no ledger or RH claim",
    "kind": "ATTACK",
    "family": "ADELIC_GROUPOID_CONNES",
    "family_secondary": [
      "LATTICE_E8_HECKE",
      "PRIME_EVENT_LOG_DECODING",
      "OPERATOR_SPECTRAL"
    ],
    "question": "Does the rank-four Gaussian E8 module canonically define a norm-flow arithmetic QSM with primitive events and no prime oracle?",
    "mechanism": "Gaussian HNF submodule census, endomorphism-semigroup isometries, exact index grading, compressed Gibbs KMS checks, and Solomon-zeta coefficient comparison.",
    "result_verdict": "CONSTRUCTED_CANONICAL_CLASSICAL",
    "outcome": "CERTIFIED",
    "solved": "Bridge 1 is constructed as a standard GL4 Gaussian arithmetic QSM with TFPT-selected module input [C].",
    "failed_because": "",
    "failure_class": "NOT_APPLICABLE",
    "rh_relevance": "IDENTITY_SIDE",
    "artifacts": {
      "probe": "experiments/tfpt-discovery/census_qsm_normflow_probe.py",
      "result_json": "experiments/tfpt-discovery/census_qsm_normflow_result.json",
      "tex": null,
      "lean": [],
      "figures": []
    },
    "reusable": "Exact Gaussian HNF coefficients, norm-flow semigroup action, finite KMS harness, and Hecke homogeneity obstruction.",
    "depends_on": [
      "verification/v714_moonshot_hecke_groupoid.py",
      "verification/v740_kms_extension_switch.py",
      "verification/v741_kms_toeplitz_semigroup.py"
    ],
    "readme_lines": "",
    "confidence": "high"
  }
]
