[
  {
    "path": "experiments/tfpt-discovery/clock_combination_spectrum_probe.py",
    "round": "PRIME.CLOCK.COMBINATION.SPECTRUM.01",
    "role": "probe",
    "ledger_ids": [],
    "status_raw": "[W] experiment-only working tree; no ledger claim",
    "kind": "ATTACK",
    "family": "DYNAMICS_CLOCKS_PF",
    "family_secondary": [
      "ADELIC_GROUPOID_CONNES",
      "PRIME_EVENT_LOG_DECODING",
      "LATTICE_E8_HECKE",
      "OPERATOR_SPECTRAL"
    ],
    "question": "Can canonical TFPT clocks or their products and towers derive a multiplicity-one log-integer spectrum without an arithmetic oracle?",
    "mechanism": "Exact valuation ranks, finite-clock periods, resummed towers, seeded modular covariance, Koide multipliers, and 63 product classifications.",
    "result_verdict": "NO_SURVIVED_BC_CANDIDATE",
    "outcome": "KILLED",
    "solved": "All 63 allowed single, pair, and triple clock combinations fail the canonical multiplicity-one log-integer criterion [C].",
    "failed_because": "Finite clocks are commensurable; log-rational towers need noncanonical integer labels; modular and physical generators lack arithmetic spectra.",
    "failure_class": "NO_BRIDGE",
    "rh_relevance": "IDENTITY_SIDE",
    "artifacts": {
      "probe": "experiments/tfpt-discovery/clock_combination_spectrum_probe.py",
      "result_json": "experiments/tfpt-discovery/clock_combination_spectrum_result.json",
      "tex": null,
      "lean": [],
      "figures": []
    },
    "reusable": "Exact log-rational rank audit, modular integrality test, and clock-product kill classifier.",
    "depends_on": [
      "verification/v319_translation_clock.py",
      "verification/v124_resummed_clock.py",
      "verification/v446_seam_clock_invariance.py",
      "verification/v506_seam_clock_rigidity.py",
      "verification/v740_kms_extension_switch.py",
      "verification/v741_kms_toeplitz_semigroup.py"
    ],
    "readme_lines": "",
    "confidence": "high"
  }
]
