[
  {
    "path": "experiments/tfpt-discovery/kneser_groupoid_halfdensity_probe.py",
    "round": "KNESER.GROUPOID.HALFDENSITY.01",
    "role": "probe",
    "ledger_ids": [],
    "status_raw": "[W] experiment-only finite computation; NO RH claim",
    "kind": "ATTACK",
    "family": "ADELIC_GROUPOID_CONNES",
    "family_secondary": [
      "LATTICE_E8_HECKE"
    ],
    "question": "Can marked E8 Kneser fibres emit the prime half-density through their modular function?",
    "mechanism": "Exact source/target counts on mu4, affine Hecke, and Type-A/B channels with composition and controls.",
    "result_verdict": "KILLED(K1)",
    "outcome": "KILLED",
    "solved": "All tested marked channels at p=3,5,7 are exactly unimodular; tree and scramble controls pass [C].",
    "failed_because": "Delta is identically one, so no channel emits p^{-m/2} under m-fold composition.",
    "failure_class": "STRUCTURAL_MISMATCH",
    "rh_relevance": "IDENTITY_SIDE",
    "artifacts": {
      "probe": "experiments/tfpt-discovery/kneser_groupoid_halfdensity_probe.py",
      "result_json": "experiments/tfpt-discovery/kneser_groupoid_halfdensity_result.json",
      "tex": null,
      "lean": [],
      "figures": []
    },
    "reusable": "Exact marked Kneser unimodularity and non-unimodular tree control.",
    "depends_on": [
      "verification/v535_hecke_from_geometry.py",
      "verification/v536_eichler_trace_layer.py",
      "GROUPOID.HALFDENSITY.GLOBAL.01"
    ],
    "readme_lines": "",
    "confidence": "high"
  },
  {
    "path": "canvases/RH-research-audit.canvas.tsx",
    "round": "CM.ISOGENY.SQUARE.01",
    "role": "chat_only_audit_claim",
    "ledger_ids": [],
    "status_raw": "Chat-only assertion; repository path and probe are absent; not auditable",
    "kind": "DOCUMENTATION",
    "family": "CM_CURVE_GEOMETRY",
    "family_secondary": [
      "LATTICE_E8_HECKE"
    ],
    "question": "Was the raw E8 Hecke trace analytically pre-killed as a source of Riemann weights?",
    "mechanism": "Unversioned chat-only audit assertion referencing a canvas path absent from the repository.",
    "result_verdict": "ASSERTED_NOT_AUDITABLE",
    "outcome": "INCONCLUSIVE",
    "solved": "Nothing auditable closed; the assertion is superseded by KNESER.GROUPOID.HALFDENSITY.01.",
    "failed_because": "No probe file exists, and the stated canvas path is absent, so the assertion cannot be reproduced.",
    "failure_class": "UNCONVERGED",
    "rh_relevance": "IDENTITY_SIDE",
    "artifacts": {
      "probe": null,
      "result_json": null,
      "tex": null,
      "lean": [],
      "figures": []
    },
    "reusable": "",
    "depends_on": [
      "experiments/tfpt-discovery/kneser_groupoid_halfdensity_probe.py"
    ],
    "readme_lines": "",
    "confidence": "low"
  }
]
