[
  {
    "path": "experiments/tfpt-discovery/evolve/evolve_props.py",
    "round": "PRIME.RDAGGER.PROGRAM_EVOLUTION.01",
    "role": "probe",
    "ledger_ids": [],
    "status_raw": "Experiment-only deterministic program evolution: T1 classical proof shape measured, T2 scalar-channel type mismatch remains, T3 finite full-cap margins positive on k=5..16 but classifier ties null; no RH claim.",
    "kind": "TOOLING",
    "family": "LEAN_FORMALIZATION",
    "family_secondary": [
      "CERTIFICATE_INFRASTRUCTURE",
      "WEIL_POSITIVITY_WINDOWS",
      "OPERATOR_SPECTRAL"
    ],
    "question": "Can evolved programs expose classical formulas for two Lean Props and map the remaining FREQ spectral kernel?",
    "mechanism": "Deterministic formula mutation, exact arch reads, Jackson diagnostics, full-cap dual-resolvent margins, held-out classifier, and Galerkin hardest-window profiles.",
    "result_verdict": "T1_CLASSICAL_SHAPE + T2_TYPE_MISMATCH + T3_NULL_TIE + OPEN_COUNT_3_TO_2_CLASSIFICATION",
    "outcome": "INCONCLUSIVE",
    "solved": "T1 has a classical Euler-Maclaurin proof plan [C]; no Lean Prop was proved.",
    "failed_because": "Jackson norm approximation does not construct the required scalar A-cap read dictionary; finite all-good margins cannot prove FREQ.",
    "failure_class": "NO_BRIDGE",
    "rh_relevance": "LOAD_BEARING_OPEN",
    "artifacts": {
      "probe": "experiments/tfpt-discovery/evolve/evolve_props.py",
      "result_json": "experiments/tfpt-discovery/evolve/results/evolution_result.json",
      "tex": null,
      "lean": [
        "rh/lean/RH/FrequentlySelected.lean",
        "rh/lean/RH/InnerBridges.lean"
      ],
      "figures": []
    },
    "reusable": "Program log, exact selected-margin evaluator, arch-rate fitness, Jackson type-check, and deterministic budget kill switch.",
    "depends_on": [
      "rh/lean/RH/FrequentlySelected.lean",
      "rh/lean/RH/InnerBridges.lean",
      "experiments/tfpt-discovery/weil_window_certificate_probe.py",
      "experiments/tfpt-discovery/weil_window_profile_scout.py",
      "experiments/tfpt-discovery/cofinal_family_probe.py",
      "experiments/tfpt-discovery/arch_rate_probe.py"
    ],
    "readme_lines": "",
    "confidence": "high"
  }
]
