[
  {
    "path": "experiments/tfpt-discovery/parabolic_detline2_probe.py",
    "round": "PRIME.PARABOLIC.DETLINE.02",
    "role": "probe",
    "ledger_ids": [
      "PRIME.PARABOLIC.DETLINE.02"
    ],
    "status_raw": "[W] working tree, not on origin/main",
    "kind": "FOUNDATION",
    "family": "ADELIC_GROUPOID_CONNES",
    "family_secondary": [
      "EXPLICIT_FORMULA_IDENTITY"
    ],
    "question": "Can a canonical boundary regularisation recover the symmetric fixed-point half-density trace and the single-shell Weil local term?",
    "mechanism": "Exact fixed-point algebra, cylinder cutoffs, attracting Hardy projection, and Gaussian local assembly.",
    "result_verdict": "KILLED_K2 (the symmetric fixed-point half-density sum is exact, but neither the canonical Busemann/cylinder cutoff nor the attracting Hardy projection converges to it; moreover its 1/(1-q^-m) odd-power resummation is not the single-shell Connes/Weil coefficient. log p and p^-1/2 are canonical. Local identity side only; the global and positivity questions are untouched.)",
    "outcome": "KILLED",
    "solved": "Fixed-point symmetry, cylinder artefact, Connes-shell discrepancy, and canonical Haar-length normalisation established exactly [C].",
    "failed_because": "Neither requested canonical operator prescription reaches L1; the fixed-point denominator is an extra odd-power resummation absent from a Connes nonzero shell.",
    "failure_class": "STRUCTURAL_MISMATCH",
    "rh_relevance": "IDENTITY_SIDE",
    "artifacts": {
      "probe": "experiments/tfpt-discovery/parabolic_detline2_probe.py",
      "result_json": "experiments/tfpt-discovery/parabolic_detline2_result.json",
      "tex": null,
      "lean": [],
      "figures": []
    },
    "reusable": "Exact boundary fixed-point versus Connes-shell trace dictionary and cylinder-cutoff no-go.",
    "depends_on": [
      "experiments/tfpt-discovery/parabolic_detline_probe.py"
    ],
    "readme_lines": "",
    "confidence": "high"
  }
]
