[
  {
    "path": "experiments/tfpt-discovery/archimedean_pi_conformity_probe.py",
    "round": "ARCHIMEDEAN.PI.CONFORMITY.01",
    "role": "probe",
    "ledger_ids": [],
    "status_raw": "[W] experiment-only working tree; no ledger or RH claim",
    "kind": "CONTROL",
    "family": "WEIL_POSITIVITY_WINDOWS",
    "family_secondary": [
      "EXPLICIT_FORMULA_IDENTITY",
      "SCREW_SUBORDINATION_LSTAR"
    ],
    "question": "How sensitive are finite Weil-window margins to the real-place log pi and Gamma terms, and do decimal pi digits correlate with primes?",
    "mechanism": "Legendre-window decomposition, analytic log-pi derivative, projected Gamma sensitivity, frozen prime-position scramble, and permutation-calibrated decimal-digit controls.",
    "result_verdict": "MEASURED: archimedean-place sensitivity quantified; no pi->prime correlation beyond theorems",
    "outcome": "MEASURED",
    "solved": "Finite-window conditioning and null controls measured numerically; no physical pi tuning and no RH implication [C].",
    "failed_because": "",
    "failure_class": "NOT_APPLICABLE",
    "rh_relevance": "FINITE_FRAGMENT",
    "artifacts": {
      "probe": "experiments/tfpt-discovery/archimedean_pi_conformity_probe.py",
      "result_json": "experiments/tfpt-discovery/archimedean_pi_conformity_result.json",
      "tex": null,
      "lean": [],
      "figures": []
    },
    "reusable": "Typed archimedean decomposition, exact log-pi derivative, scramble and digit-null controls.",
    "depends_on": [
      "experiments/tfpt-discovery/weil_window_certificate_probe.py",
      "experiments/tfpt-discovery/weil_window_profile_scout.py"
    ],
    "readme_lines": "",
    "confidence": "high"
  }
]
