[
  {
    "path": "rh/catalog/analysis/all_place_tate_audit.md",
    "round": "2026-09-05-all-place-audit",
    "role": "analysis",
    "ledger_ids": [],
    "status_raw": "Exact Tate identities and rank-nullity lemma; application to the Weil window is conditional on an external strict-floor preprint; global all-place realization and positivity remain open; no RH claim",
    "kind": "DOCUMENTATION",
    "family": "ARAKELOV_HODGE_INTERSECTION",
    "family_secondary": [
      "EXPLICIT_FORMULA_IDENTITY",
      "OPERATOR_SPECTRAL",
      "LATTICE_E8_HECKE"
    ],
    "question": "Can the rigid level-8 Calabi--Yau Tate factor carry the complete Weil form?",
    "mechanism": "Separate exact local factors, finite-carrier rank, quantum variants and the global all-place intersection obligation.",
    "result_verdict": "TATE_FACTOR_EXACT; FIXED_FINITE_CARRIER_NO_GO; ALL_PLACE_INTERSECTION_OPEN",
    "outcome": "RESTATED",
    "solved": "The Tate factor and abstract rank-nullity lemma are exact. Conditional on the external strict-floor premise, the stated exact-linear pullback cannot use one fixed finite carrier; nonlinear methods, growing finite families and direct limits are not excluded.",
    "failed_because": "No zero-independent correspondence compiler, all-place intersection identity or independent absolute Hodge-index theorem is constructed.",
    "failure_class": "NO_BRIDGE",
    "rh_relevance": "LOAD_BEARING_OPEN",
    "artifacts": {
      "probe": "verification/v1021_all_place_tate_rank_audit.py",
      "result_json": "rh/catalog/analysis/all_place_tate_audit.json",
      "tex": null,
      "lean": [],
      "figures": []
    },
    "reusable": "Seven-gate A1--A7 completion contract with exact local normalization and claim fences.",
    "depends_on": [
      "verification/v1021_all_place_tate_rank_audit.py",
      "rh/catalog/analysis/geometry_audit.md",
      "verification/v912_form_convergence_theorem.py",
      "verification/v913_signed_alignment_localization.py"
    ],
    "readme_lines": "",
    "confidence": "high"
  },
  {
    "path": "verification/v1021_all_place_tate_rank_audit.py",
    "round": "v1021",
    "role": "verification_module",
    "ledger_ids": [
      "PRIME.ALLPLACE.TATE.INTERSECTION.01"
    ],
    "status_raw": "23/23 exact symbolic checks; local Tate identities proved, fixed finite linear carriers excluded under the cited strict-window premise, global intersection open; no RH claim",
    "kind": "FOUNDATION",
    "family": "EXPLICIT_FORMULA_IDENTITY",
    "family_secondary": [
      "ARAKELOV_HODGE_INTERSECTION",
      "LATTICE_E8_HECKE",
      "WEIL_POSITIVITY_WINDOWS"
    ],
    "question": "What survives after isolating zeta through the rigid Calabi--Yau Tate projector?",
    "mechanism": "Exact projector and local-factor algebra, rank--nullity obstruction, and sparse Rankin counterexample.",
    "result_verdict": "TATE_FACTOR_EXACT; FIXED_FINITE_CARRIER_NO_GO; RANKIN_EXPONENT_DROP_FALSIFIED; ALL_PLACE_INTERSECTION_OPEN",
    "outcome": "PROVED",
    "solved": "Tate factorization, pole normalization, the abstract rank-nullity lemma and the historical Rankin counterexample are exact; applying the lemma to the Weil window is conditional on the external strict-floor preprint.",
    "failed_because": "The module does not construct the infinite all-place correspondence space or prove its global polarization.",
    "failure_class": "NOT_APPLICABLE",
    "rh_relevance": "IDENTITY_SIDE",
    "artifacts": {
      "probe": "verification/v1021_all_place_tate_rank_audit.py",
      "result_json": "rh/catalog/analysis/all_place_tate_audit.json",
      "tex": null,
      "lean": [],
      "figures": []
    },
    "reusable": "Exact Tate projector, bad-place scalar factor, pole ward, abstract rank-nullity lemma with an external-premise fence, and sparse mean-to-pointwise counterexample.",
    "depends_on": [
      "experiments/tfpt-discovery/rankin_positivity_miniature_probe.py"
    ],
    "readme_lines": "",
    "confidence": "high"
  },
  {
    "path": "experiments/tfpt-discovery/rankin_positivity_miniature_probe.py",
    "round": "T49-correction-2026-09-05",
    "role": "discovery_probe",
    "ledger_ids": [],
    "status_raw": "Historical MINIATURE-RUNS superseded by correction of record; finite identities survive; no RH bridge",
    "kind": "ATTACK",
    "family": "LATTICE_E8_HECKE",
    "family_secondary": [
      "EXPLICIT_FORMULA_IDENTITY"
    ],
    "question": "Does Rankin--Selberg mean growth imply the claimed sharp pointwise coefficient exponent?",
    "mechanism": "Retain finite identities and test the exponent extraction with an exact sparse sequence.",
    "result_verdict": "RANKIN-EXPONENT-DROP-FALSIFIED; FINITE-IDENTITIES-SURVIVE",
    "outcome": "KILLED",
    "solved": "The mean-to-pointwise exponent inference is refuted; the valid Hecke, Jacobi and local-factor identities remain.",
    "failed_because": "Partial-sum growth controls a mean, not uniform coefficients; the fitted maximum reused the evaluation window.",
    "failure_class": "ORACLE_LEAK",
    "rh_relevance": "FINITE_FRAGMENT",
    "artifacts": {
      "probe": "experiments/tfpt-discovery/rankin_positivity_miniature_probe.py",
      "result_json": null,
      "tex": null,
      "lean": [],
      "figures": []
    },
    "reusable": "Finite f8 and Delta identities plus corrected symmetric-square Euler-factor checks.",
    "depends_on": [],
    "readme_lines": "",
    "confidence": "high",
    "needs_review": false,
    "draft": false,
    "reconciled": true,
    "superseded_by": "verification/v1021_all_place_tate_rank_audit.py",
    "reconciliation_note": "IDENTITY_VS_ROUTE: finite identities survive, while the exponent extraction and sole-vacant-family narrative are superseded."
  },
  {
    "path": "experiments/tfpt-discovery/heat_gabor_restatement_probe.py",
    "round": "2026-09-05-external-heat-A",
    "role": "discovery_probe",
    "ledger_ids": [],
    "status_raw": "Cross term, heat equation, back-transform and convolution normalization verified; prime saddle budget measured; criterion remains an equivalent Gabor/Weil restatement; no RH claim",
    "kind": "ATTACK",
    "family": "WEIL_POSITIVITY_WINDOWS",
    "family_secondary": [
      "EXPLICIT_FORMULA_IDENTITY",
      "DYNAMICS_CLOCKS_PF"
    ],
    "question": "Does heat normalization turn Gabor positivity into a weaker criterion with a controllable source budget?",
    "mechanism": "Cancel the central lobe, identify Gaussian convolution, and compare exact prime partial sums with saddle and slack scales.",
    "result_verdict": "RESTATED",
    "outcome": "RESTATED",
    "solved": "The heat-kernel identity and normalization artifact are exact; the criterion remains equivalent-strength.",
    "failed_because": "The arithmetic source still requires cancellation from exp(1/(8a)) scale to exp(1/sqrt(a)) precision.",
    "failure_class": "RESTATEMENT",
    "rh_relevance": "EQUIVALENCE",
    "artifacts": {
      "probe": "experiments/tfpt-discovery/heat_gabor_restatement_probe.py",
      "result_json": "experiments/tfpt-discovery/heat_gabor_restatement_probe_result.json",
      "tex": null,
      "lean": [],
      "figures": []
    },
    "reusable": "Exact heat-kernel normalization, inverse transform, and fail-closed prime-tail budget.",
    "depends_on": [
      "r608",
      "r605B/r605C",
      "experiments/tfpt-discovery/gabor_tropical_heat_probe.py",
      "rh/lean/RH/GaborExposedOrbit.lean"
    ],
    "readme_lines": "",
    "confidence": "high"
  },
  {
    "path": "experiments/tfpt-discovery/nb_dyadic_capture_probe.py",
    "round": "2026-09-05-external-nb-B",
    "role": "discovery_probe",
    "ledger_ids": [],
    "status_raw": "Periodic digamma and Vasyunin Gram formulas cross-checked; supplied E_N and eta ladder reproduced through N=512; eta lower bound remains conjectural; no RH claim",
    "kind": "ATTACK",
    "family": "OPERATOR_SPECTRAL",
    "family_secondary": [
      "MELLIN_PICK_LEE_YANG",
      "TOEPLITZ_MOMENT_POSITIVITY"
    ],
    "question": "Does each dyadic NB block capture at least a harmonic fraction of the current approximation residual?",
    "mechanism": "Compute Vasyunin Gram Schur complements and project the residual onto residualized binary-block functions.",
    "result_verdict": "MEASURED",
    "outcome": "MEASURED",
    "solved": "The finite ladder and supplied values reproduce; k eta_k reaches 0.994 at N=512.",
    "failed_because": "No uniform lower bound for residual projection through the ill-conditioned Vasyunin Schur complements is proved.",
    "failure_class": "NOT_APPLICABLE",
    "rh_relevance": "EQUIVALENCE",
    "artifacts": {
      "probe": "experiments/tfpt-discovery/nb_dyadic_capture_probe.py",
      "result_json": "experiments/tfpt-discovery/nb_dyadic_capture_probe_result.json",
      "tex": null,
      "lean": [],
      "figures": []
    },
    "reusable": "Dyadic block transform, Schur-capture computation, and 80-digit Gram cross-check.",
    "depends_on": [
      "experiments/tfpt-discovery/baez_duarte_probe.py",
      "experiments/tfpt-discovery/beurling_nyman_gram_probe.py",
      "PRIME.BAEZDUARTE.01"
    ],
    "readme_lines": "",
    "confidence": "high"
  }
]
