[
  {
    "path": "rh/lean/RH/SelectedArchErrorQuadraticRateClassical.lean",
    "round": "r475-repair",
    "role": "lean_module",
    "ledger_ids": [],
    "status_raw": "FALSIFIED fixed archRateConst; corrected existential-rate interface added; downstream convergence proved; existence remains open on weighted interpolation transcription; no RH claim",
    "kind": "FORMALIZATION",
    "family": "LEAN_FORMALIZATION",
    "family_secondary": [
      "EXPLICIT_FORMULA_IDENTITY",
      "WEIL_POSITIVITY_WINDOWS"
    ],
    "question": "Does the fixed r475 archRateConst bound every selected-path grid autocorrelation?",
    "mechanism": "Formalized affine interpolation error, endpoint-kink defect, corrected existential-rate interface, and downstream convergence.",
    "result_verdict": "FIXED_CONSTANT_FALSIFIED: 8.0283 > 4.1259765625; selectedArchError_tendsto_zero_of_rateExists PROVED; SelectedArchErrorQuadraticRateExists OPEN",
    "outcome": "KILLED",
    "solved": "The fixed constant is falsified; endpoint defect and existential-rate downstream convergence are proved sorry-free [E].",
    "failed_because": "Existence still needs SelectedArchWeightedInterpolationEstimate for the productionArchLag near/far integrals.",
    "failure_class": "LOSSY_CONSTANT",
    "rh_relevance": "IDENTITY_SIDE",
    "artifacts": {
      "probe": null,
      "result_json": null,
      "tex": null,
      "lean": [
        "rh/lean/RH/InnerBridges.lean",
        "rh/lean/RH/SelectedArchErrorQuadraticRateClassical.lean"
      ],
      "figures": []
    },
    "reusable": "Explicit 1/12 estimate, endpoint-kink defect, corrected Exists-rate interface, and tendsto consumer.",
    "depends_on": [
      "rh/lean/RH/InnerBridges.lean",
      "rh/lean/RH/SelectedArchErrorQuadraticRateClassical.lean"
    ],
    "readme_lines": "6861-6886",
    "confidence": "high"
  }
]
